{
  "average_recall_at_k": 1.0,
  "blocked_actions": [
    "auto_ingest",
    "bulk_crawl",
    "bulk_download",
    "compute_embedding",
    "control_gui",
    "submit_solver",
    "train_neural_index",
    "write_formal_engineering_state",
    "write_formal_index"
  ],
  "created_at": "2026-06-03T12:00:00+00:00",
  "index_gate": {
    "candidate_entry_count": 37,
    "duplicate_card_id_count": 0,
    "duplicate_card_ids": [],
    "duplicate_entry_id_count": 0,
    "duplicate_entry_ids": [],
    "embedding_status": "not_built",
    "formal_index_allowed_count": 0,
    "index_validation_error_count": 0,
    "index_validation_status": "pass",
    "training_status": "not_started"
  },
  "index_id": "index_r24_process_rag_candidate_snapshot",
  "index_schema_version": "autoform.process_rag_candidate_index.r24.v1",
  "object_type": "ProcessRagCandidateIndexEvaluationReport",
  "pass_count": 6,
  "phase": "R25",
  "query_count": 6,
  "report_id": "report_r25_candidate_index_retrieval_gate",
  "results": [
    {
      "expected_card_ids": [
        "pkc_r15_parameter_blank_thickness_pending_001",
        "pkc_r15_process_case_dc04_d20_pending_001"
      ],
      "failures": [],
      "formal_index_allowed_count": 0,
      "matched_card_ids": [
        "pkc_r15_parameter_blank_thickness_pending_001",
        "pkc_r15_process_case_dc04_d20_pending_001"
      ],
      "matched_entry_count": 2,
      "query": "DC04 D-20 blank thickness process route",
      "query_id": "eval_r25_dc04_d20_blank_thickness",
      "recall_at_k": 1.0,
      "retrieval_trace": {
        "blocked_actions": [
          "auto_ingest",
          "bulk_crawl",
          "bulk_download",
          "compute_embedding",
          "control_gui",
          "submit_solver",
          "train_neural_index",
          "write_formal_engineering_state",
          "write_formal_index"
        ],
        "candidate_entry_count": 37,
        "created_at": "2026-06-03T12:00:00+00:00",
        "excluded_entries": [
          {
            "card_id": "pkc_r15_material_dc04_pending_001",
            "card_type": "MaterialCard",
            "entry_id": "idx_pkc_r15_material_dc04_pending_001",
            "reasons": [
              "card_type_filtered",
              "process_action_filtered"
            ],
            "source_id": "source_enterprise_internal_dataset_pending"
          },
          {
            "card_id": "pkc_r15_operation_route_d20_pending_001",
            "card_type": "OperationRoute",
            "entry_id": "idx_pkc_r15_operation_route_d20_pending_001",
            "reasons": [
              "card_type_filtered"
            ],
            "source_id": "source_enterprise_internal_dataset_pending"
          },
          {
            "card_id": "pkc_r15_quality_traceability_gate_001",
            "card_type": "QualityCriteria",
            "entry_id": "idx_pkc_r15_quality_traceability_gate_001",
            "reasons": [
              "card_type_filtered",
              "process_action_filtered"
            ],
            "source_id": "source_enterprise_internal_dataset_pending"
          },
          {
            "card_id": "pkc_r15_public_literature_metadata_arxiv_001",
            "card_type": "ProcessCase",
            "entry_id": "idx_pkc_r15_public_literature_metadata_arxiv_001",
            "reasons": [
              "material_filtered",
              "process_action_filtered"
            ],
            "source_id": "source_arxiv_api_metadata"
          },
          {
            "card_id": "pkc_r21_crossref_public_metadata_case_001",
            "card_type": "ProcessCase",
            "entry_id": "idx_pkc_r21_crossref_public_metadata_case_001",
            "reasons": [
              "material_filtered",
              "process_action_filtered"
            ],
            "source_id": "source_crossref_rest_metadata"
          },
          {
            "card_id": "pkc_r21_crossref_public_metadata_case_002",
            "card_type": "ProcessCase",
            "entry_id": "idx_pkc_r21_crossref_public_metadata_case_002",
            "reasons": [
              "material_filtered",
              "process_action_filtered"
            ],
            "source_id": "source_crossref_rest_metadata"
          },
          {
            "card_id": "pkc_r21_crossref_public_metadata_case_003",
            "card_type": "ProcessCase",
            "entry_id": "idx_pkc_r21_crossref_public_metadata_case_003",
            "reasons": [
              "material_filtered",
              "process_action_filtered"
            ],
            "source_id": "source_crossref_rest_metadata"
          },
          {
            "card_id": "pkc_r21_nist_pdr_process_chain_case_001",
            "card_type": "ProcessCase",
            "entry_id": "idx_pkc_r21_nist_pdr_process_chain_case_001",
            "reasons": [
              "material_filtered",
              "process_action_filtered"
            ],
            "source_id": "source_nist_public_data_repository"
          },
          {
            "card_id": "pkc_r21_nist_pdr_process_chain_case_002",
            "card_type": "ProcessCase",
            "entry_id": "idx_pkc_r21_nist_pdr_process_chain_case_002",
            "reasons": [
              "material_filtered",
              "process_action_filtered"
            ],
            "source_id": "source_nist_public_data_repository"
          },
          {
            "card_id": "pkc_r21_nist_pdr_process_chain_case_003",
            "card_type": "ProcessCase",
            "entry_id": "idx_pkc_r21_nist_pdr_process_chain_case_003",
            "reasons": [
              "material_filtered",
              "process_action_filtered"
            ],
            "source_id": "source_nist_public_data_repository"
          },
          {
            "card_id": "pkc_r21_nist_mdr_materials_metadata_case_001",
            "card_type": "ProcessCase",
            "entry_id": "idx_pkc_r21_nist_mdr_materials_metadata_case_001",
            "reasons": [
              "material_filtered",
              "process_action_filtered"
            ],
            "source_id": "source_nist_materials_data_repository"
          },
          {
            "card_id": "pkc_r21_nist_mdr_materials_metadata_case_002",
            "card_type": "ProcessCase",
            "entry_id": "idx_pkc_r21_nist_mdr_materials_metadata_case_002",
            "reasons": [
              "material_filtered",
              "process_action_filtered"
            ],
            "source_id": "source_nist_materials_data_repository"
          },
          {
            "card_id": "pkc_r21_nist_mdr_materials_metadata_case_003",
            "card_type": "ProcessCase",
            "entry_id": "idx_pkc_r21_nist_mdr_materials_metadata_case_003",
            "reasons": [
              "material_filtered",
              "process_action_filtered"
            ],
            "source_id": "source_nist_materials_data_repository"
          },
          {
            "card_id": "pkc_r21_nist_pdr_factory_operations_case_001",
            "card_type": "ProcessCase",
            "entry_id": "idx_pkc_r21_nist_pdr_factory_operations_case_001",
            "reasons": [
              "material_filtered",
              "process_action_filtered"
            ],
            "source_id": "source_nist_public_data_repository"
          },
          {
            "card_id": "pkc_r21_nist_pdr_factory_operations_case_002",
            "card_type": "ProcessCase",
            "entry_id": "idx_pkc_r21_nist_pdr_factory_operations_case_002",
            "reasons": [
              "material_filtered",
              "process_action_filtered"
            ],
            "source_id": "source_nist_public_data_repository"
          },
          {
            "card_id": "pkc_r21_nist_pdr_factory_operations_case_003",
            "card_type": "ProcessCase",
            "entry_id": "idx_pkc_r21_nist_pdr_factory_operations_case_003",
            "reasons": [
              "material_filtered",
              "process_action_filtered"
            ],
            "source_id": "source_nist_public_data_repository"
          },
          {
            "card_id": "pkc_r21_autoform_public_site_page_001",
            "card_type": "ProcessCase",
            "entry_id": "idx_pkc_r21_autoform_public_site_page_001",
            "reasons": [
              "material_filtered",
              "process_action_filtered"
            ],
            "source_id": "source_autoform_public_site_metadata"
          },
          {
            "card_id": "pkc_r21_autoform_public_site_page_002",
            "card_type": "ProcessCase",
            "entry_id": "idx_pkc_r21_autoform_public_site_page_002",
            "reasons": [
              "material_filtered",
              "process_action_filtered"
            ],
            "source_id": "source_autoform_public_site_metadata"
          },
          {
            "card_id": "pkc_r21_autoform_public_site_page_003",
            "card_type": "ProcessCase",
            "entry_id": "idx_pkc_r21_autoform_public_site_page_003",
            "reasons": [
              "material_filtered",
              "process_action_filtered"
            ],
            "source_id": "source_autoform_public_site_metadata"
          },
          {
            "card_id": "pkc_r21_nist_pdr_logistics_chain_case_001",
            "card_type": "ProcessCase",
            "entry_id": "idx_pkc_r21_nist_pdr_logistics_chain_case_001",
            "reasons": [
              "material_filtered",
              "process_action_filtered"
            ],
            "source_id": "source_nist_public_data_repository"
          },
          {
            "card_id": "pkc_r21_nist_pdr_logistics_chain_case_002",
            "card_type": "ProcessCase",
            "entry_id": "idx_pkc_r21_nist_pdr_logistics_chain_case_002",
            "reasons": [
              "material_filtered",
              "process_action_filtered"
            ],
            "source_id": "source_nist_public_data_repository"